,0,1,2,3,4,5
0,Unit of Competency,Learning Outcomes,Learning Activities,Methodology,Assessment Method,Nominal Duration
1,,,Determine non- germinating seeds result of germination test Return and exchange non- germinating seeds,Power point presentation Research activity Incomplete worksheet Role playing Hands-on,Demonstration Written examination Oral questioning,2 hrs
2,2. Perform land preparation,2.1 Perform pre- tillage operations,Discuss proper land cleaning activities,Lecture / discussion Demonstration Field Visits Video presentation Power point presentation Role playing Incomplete Worksheet,Demonstration Written examination Oral questioning Interview,(Total-36 hrs) 1 hr
3,,,"Identify tools, material and equipment Prepare tools, material and equipment",Lecture / discussion Demonstration Field Visits Video presentation Power point presentation Role playing Incomplete Worksheet,Demonstration Written examination Oral questioning,1hr
4,,,Discuss OSHS PPE Practice OSHS,Lecture / discussion Demonstration Field Visits Video presentation Power point presentation Role playing Incomplete Worksheet,Demonstration Written examination Oral questioning,1hr
5,,,Enumerate different machinery services Source out machinery,Lecture / discussion Demonstration,Demonstration Written examination,2hrs
